{
  "form": "antrag",
  "document": "urn:uuid:6a0f3c2e-8d41-4b7a-9e15-2c7d0b4f6a18",
  "status": "submitted",
  "submittedAt": "2026-10-12T20:23:52Z",
  "values": {
    "vorname": "Maria",
    "nachname": "Muster",
    "geburtsdatum": "1988-03-14",
    "email": "maria.muster@beispiel.at",
    "telefon": "+43 512 123456",
    "familienstand": "verheiratet",
    "kinder": 1,
    "beschaeftigung": "angestellt",
    "firmenname": null,
    "gruendungsjahr": null,
    "mitantrag": true,
    "mit_vorname": "Thomas",
    "mit_nachname": "Muster",
    "mit_einkommen": 2480.5,
    "einkommen": 2950,
    "sonstige_einnahmen": 138.3,
    "einnahmen_gesamt": 5568.8,
    "wohnkosten": 1150,
    "lebenshaltung": 1850,
    "bestehende_kredite": false,
    "kreditrate": null,
    "restschuld": null,
    "ausgaben_gesamt": 3000,
    "frei_verfuegbar": 2568.8,
    "kaufpreis": 420000,
    "nebenkosten_satz": 0.1,
    "nebenkosten": 42000,
    "eigenmittel": 105000,
    "finanzierungsbedarf": 357000,
    "eigenmittelquote": 0.2273,
    "laufzeit_jahre": 25,
    "zinssatz": 0.035,
    "monatsrate": 1787.23,
    "belastungsquote": 0.3209,
    "kontoinhaber": "Maria Muster",
    "iban": "AT61 1904 3002 3457 3201",
    "antragsdatum": "2026-10-12",
    "ort": "Innsbruck",
    "angaben_richtig": true,
    "datenschutz": true
  }
}
