{
  "form": "antrag",
  "document": "urn:uuid:6a0f3c2e-8d41-4b7a-9e15-2c7d0b4f6a18",
  "status": "draft",
  "values": {
    "vorname": null,
    "nachname": null,
    "geburtsdatum": null,
    "email": null,
    "telefon": null,
    "familienstand": null,
    "kinder": 0,
    "beschaeftigung": null,
    "firmenname": null,
    "gruendungsjahr": null,
    "mitantrag": false,
    "mit_vorname": null,
    "mit_nachname": null,
    "mit_einkommen": null,
    "einkommen": null,
    "sonstige_einnahmen": null,
    "einnahmen_gesamt": 0,
    "wohnkosten": null,
    "lebenshaltung": null,
    "bestehende_kredite": false,
    "kreditrate": null,
    "restschuld": null,
    "ausgaben_gesamt": 0,
    "frei_verfuegbar": 0,
    "kaufpreis": null,
    "nebenkosten_satz": 0.1,
    "nebenkosten": 0,
    "eigenmittel": null,
    "finanzierungsbedarf": 0,
    "eigenmittelquote": 0,
    "laufzeit_jahre": null,
    "zinssatz": 0.035,
    "monatsrate": 0,
    "belastungsquote": 0,
    "kontoinhaber": null,
    "iban": null,
    "antragsdatum": null,
    "ort": null,
    "angaben_richtig": false,
    "datenschutz": false
  }
}
